{
  "slug": "bless",
  "name": "Bless",
  "level": 1,
  "school": "Enchantment",
  "castingTime": "1 action",
  "range": "30 feet",
  "components": "V, S, M",
  "duration": "Concentration, up to 1 minute",
  "description": "You bless up to three creatures of your choice within range. Whenever a target makes an attack roll or saving throw, it can add a d4 to the result.",
  "classes": [
    "cleric",
    "paladin"
  ],
  "source": "SRD 5.1",
  "source_ref": "SRD 5.1, Spells: Bless",
  "license": "CC-BY-4.0"
}