{
  "slug": "guidance",
  "name": "Guidance",
  "level": 0,
  "school": "Divination",
  "castingTime": "1 action",
  "range": "Touch",
  "components": "V, S",
  "duration": "Concentration, up to 1 minute",
  "description": "You touch one willing creature. Once before the spell ends, the target can roll a d4 and add the number rolled to one ability check of its choice.",
  "classes": [
    "cleric",
    "druid"
  ],
  "source": "SRD 5.1",
  "source_ref": "SRD 5.1, Spells: Guidance",
  "license": "CC-BY-4.0"
}