{
  "slug": "resistance",
  "name": "Resistance",
  "level": 0,
  "school": "Abjuration",
  "castingTime": "1 action",
  "range": "Touch",
  "components": "V, S, M",
  "duration": "Concentration, up to 1 minute",
  "description": "You touch one willing creature. Once before the spell ends, the target can roll a d4 and add the number rolled to one saving throw of its choice.",
  "classes": [
    "cleric",
    "druid"
  ],
  "source": "SRD 5.1",
  "source_ref": "SRD 5.1, Spells: Resistance",
  "license": "CC-BY-4.0"
}