{
  "slug": "light",
  "name": "Light",
  "level": 0,
  "school": "Evocation",
  "castingTime": "1 action",
  "range": "Touch",
  "components": "V, M",
  "duration": "1 hour",
  "description": "You touch one object that is no larger than 10 feet in any dimension. The object sheds bright light in a 20-foot radius and dim light for an additional 20 feet.",
  "classes": [
    "bard",
    "cleric",
    "sorcerer",
    "wizard"
  ],
  "source": "SRD 5.1",
  "source_ref": "SRD 5.1, Spells: Light",
  "license": "CC-BY-4.0"
}