{
  "slug": "magic-missile",
  "name": "Magic Missile",
  "level": 1,
  "school": "Evocation",
  "castingTime": "1 action",
  "range": "120 feet",
  "components": "V, S",
  "duration": "Instantaneous",
  "description": "You create three glowing darts of magical force. Each dart hits a creature of your choice that you can see within range, dealing 1d4 + 1 force damage each.",
  "classes": [
    "sorcerer",
    "wizard"
  ],
  "source": "SRD 5.1",
  "source_ref": "SRD 5.1, Spells: Magic Missile",
  "license": "CC-BY-4.0"
}