{
  "slug": "fire-bolt",
  "name": "Fire Bolt",
  "level": 0,
  "school": "Evocation",
  "castingTime": "1 action",
  "range": "120 feet",
  "components": "V, S",
  "duration": "Instantaneous",
  "description": "You hurl a mote of fire at a creature or object within range. Make a ranged spell attack. On a hit, the target takes 1d10 fire damage.",
  "classes": [
    "sorcerer",
    "wizard"
  ],
  "source": "SRD 5.1",
  "source_ref": "SRD 5.1, Spells: Fire Bolt",
  "license": "CC-BY-4.0"
}