{
  "slug": "spiritual-weapon",
  "name": "Spiritual Weapon",
  "level": 2,
  "school": "Evocation",
  "castingTime": "1 bonus action",
  "range": "60 feet",
  "components": "V, S",
  "duration": "1 minute",
  "description": "You create a floating, spectral weapon within range that lasts for the duration or until you cast this spell again. Deals 1d8 + casting mod force damage.",
  "classes": [
    "cleric"
  ],
  "source": "SRD 5.1",
  "source_ref": "SRD 5.1, Spells: Spiritual Weapon",
  "license": "CC-BY-4.0"
}