{
  "slug": "burning-hands",
  "name": "Burning Hands",
  "level": 1,
  "school": "Evocation",
  "castingTime": "1 action",
  "range": "Self (15-foot cone)",
  "components": "V, S",
  "duration": "Instantaneous",
  "description": "As you hold your hands with thumbs touching, a thin sheet of flames shoots forth. Each creature in a 15-foot cone takes 3d6 fire damage (DEX save half).",
  "classes": [
    "sorcerer",
    "wizard"
  ],
  "source": "SRD 5.1",
  "source_ref": "SRD 5.1, Spells: Burning Hands",
  "license": "CC-BY-4.0"
}